{
  "schema_version": "1.0.0",
  "alert_id": "c1a2b3c4-d5e6-4f70-8a9b-0c1d2e3f4a5b",
  "session_id": "3f1b2c4d-5e6f-4a7b-8c9d-0e1f2a3b4c5d",
  "timestamp": "2026-09-21T13:24:06Z",
  "severity": "CRITICAL",
  "code": "RMSSD_DROP",
  "message": "RMSSD dropped below the autonomic recovery threshold.",
  "metric": "rmssd_hrv_ms",
  "value": 18.2,
  "threshold": 25.0
}
